<?xml version="1.0" encoding="UTF-8"?>
<instructions xmlns:xsi="http://www.w3.org/2001/XMLSchema-instance"
              xsi:schemaLocation="http://www.onehippo.org/essentials/instructions /instructions.xsd" xmlns="http://www.onehippo.org/essentials/instructions">
    <instructionSet>
        <file action="copy" overwrite="true" source="/essentials-component-document.jsp" target="${jspRoot}/essentials/essentials-component-document.jsp"/>
        <file action="copy" overwrite="true" source="/essentials-component-events.jsp" target="${jspRoot}/essentials/essentials-component-events.jsp"/>
        <file action="copy" overwrite="true" source="/essentials-component-event-detail.jsp" target="${jspRoot}/essentials/essentials-component-event-detail.jsp"/>
        <file action="copy" overwrite="true" source="/essentials-component-list.jsp" target="${jspRoot}/essentials/essentials-component-list.jsp"/>
        <file action="copy" overwrite="true" source="/essentials-component-news.jsp" target="${jspRoot}/essentials/essentials-component-news.jsp"/>
        <file action="copy" overwrite="true" source="/essentials-component-news-detail.jsp" target="${jspRoot}/essentials/essentials-component-news-details.jsp"/>

    </instructionSet>

</instructions>