<?xml version="1.0" encoding="UTF-8"?>
<instructions xmlns:xsi="http://www.w3.org/2001/XMLSchema-instance"
              xsi:schemaLocation="http://www.onehippo.org/essentials/instructions /instructions.xsd" xmlns="http://www.onehippo.org/essentials/instructions">

  <instructionSet>
    <xml action="copy" source="powerpack/xml/hst/search-catalog.xml" target="/hst:hst/hst:configurations/{{namespace}}/hst:catalog"/>
    <xml action="copy" source="powerpack/xml/hst/search-menu-item.xml" target="/hst:hst/hst:configurations/{{namespace}}/hst:sitemenus/main"/>
    <xml action="copy" source="powerpack/xml/hst/search-page.xml" target="/hst:hst/hst:configurations/{{namespace}}/hst:pages"/>
    <xml action="copy" source="powerpack/xml/hst/search-sitemap.xml" target="/hst:hst/hst:configurations/{{namespace}}/hst:sitemap"/>
  </instructionSet>
  <instructionSet group="jsp">
    <file action="copy" source="powerpack/jsp/essentials-search.jsp" target="{{jspRoot}}/essentials/essentials-search.jsp"/>
    <xml action="copy" source="powerpack/xml/hst/search-template-jsp.xml" target="/hst:hst/hst:configurations/{{namespace}}/hst:templates"/>
  </instructionSet>
  <instructionSet group="freemarker">
    <file action="copy" source="powerpack/freemarker/essentials-search.ftl" target="{{freemarkerRoot}}/essentials/essentials-search.ftl"/>
    <xml action="copy" source="powerpack/xml/hst/search-template-jsp.xml" target="/hst:hst/hst:configurations/{{namespace}}/hst:templates"/>
  </instructionSet>
</instructions>
